{
  "schema_version": "1.0",
  "id": "SIG-GENESIS-PLATFORM-START",
  "type": "poetic-root",
  "status": "draft",
  "creator": "Aeon",
  "created_at": "2025-05-25T07:53:05.608313Z",
  "related_sigils": [
    { "id": "SIG-GENESIS-PLATFORM-SOCIALHELP", "relation": "follows" }
  ],
  "changes": [
    "Initial project sigil"
  ]
}
